id,customerId,driverId,rideStatus,rideType,pickupPoint,pickupLat,pickupLong,dropPoint,dropLat,dropLong,initialDistance,initialDuration,finalDistance,finalDuration,payWithNuraCoins,appliedVoucherId,appliedCouponId,rideAssignedLat,rideAssignedLong,initialFare,finalFare,payableAmount,rideStartTime,rideEndTime,rideAssignedTime,initialOdometer,finalOdometer,createdAt,updatedAt,schoolRideBookingId
770,379,,OUTSIDE_SERVICE_AREA,RIDE,"44RR+GQ9, Devi Eswari Nagar, Thendral Nagar East, Saraswati Nagar, Thirumullaivoyal, Chennai, Tamil Nadu 600062, India",13.1412752,80.1419615,"Keerthika Apartment, Plot No, 195 & 196, 7th St, Nagalakshmi Nagar, Sankarapuram, Sithalapakkam, Chennai, Tamil Nadu 600131, India",12.8783967,80.1899633,46.716,4870,0,0,f,,,,,0,,,,,,,,22-10-2025,11:23:45,22-10-2025
771,379,,OUTSIDE_SERVICE_AREA,RIDE,"44RR+GQ9, Devi Eswari Nagar, Thendral Nagar East, Saraswati Nagar, Thirumullaivoyal, Chennai, Tamil Nadu 600062, India",13.1413289,80.1420127,"Keerthika Apartment, Plot No, 195 & 196, 7th St, Nagalakshmi Nagar, Sankarapuram, Sithalapakkam, Chennai, Tamil Nadu 600131, India",12.8783967,80.1899633,46.721,4871,0,0,f,,,,,0,,,,,,,,22-10-2025,11:24:10,22-10-2025
775,258,,DRIVER_NOT_FOUND,RIDE,"Palani Towers, Palani Towers, Amudham Colony, T. Nagar, Chennai, Tamil Nadu 600017, India",13.0334159,80.2387425,"Ashwin Apartment, 27GC+7VQ, 5th Trust Cross St, Mandavelipakkam, Raja Annamalaipuram, Chennai, Tamil Nadu 600028, India",13.025708,80.2722357,6.296,1241,0,0,f,,,,,126,,,,,,,,22-10-2025,12:16:47,22-10-2025
774,380,,DRIVER_NOT_FOUND,RIDE,"67/28, Sowcarpet, George Town, Chennai, Tamil Nadu 600001, India",13.08985408,80.28222576,"Vaibhav Apartments, 62, E VK Sampath Rd, Periamet, Vepery, Chennai, Tamil Nadu 600007, India",13.0832081,80.2621111,3.226,740,0,0,f,,,,,89,,,,,,,,22-10-2025,12:13:50,22-10-2025
779,90,,OUTSIDE_SERVICE_AREA,RIDE,"253, Jagannathan Salai, S.R.P Colony, Periyar Nagar West, Perambur, Chennai, Tamil Nadu 600082, India",13.116289,80.2261178,"Chennai One IT SEZ, Infra Limited, 200 Feet Radial Rd, MCN Nagar Extension, Pallavaram, Thoraipakkam, Chennai, Tamil Nadu 600097, India",12.9478516,80.2322068,29.738,4093,0,0,f,,,,,0,,,,,,,,22-10-2025,17:51:32,22-10-2025
778,345,,PENDING,RIDE,"18/6, Dasarathapuram Main Rd, Dasaratha Puram, Saligramam, Chennai, Tamil Nadu 600093, India",13.05738,80.2028683,"1st Main Road, 1st Main Rd, Sri Venkatesh Nagar, Sai Baba Colony, Virugambakkam, Chennai, Tamil Nadu, India",13.0567662,80.1945449,1.061,265,0,0,f,,,,,49,,,,,,,,22-10-2025,16:37:23,22-10-2025
780,90,,PENDING,RIDE,"253, Jagannathan Salai, S.R.P Colony, Periyar Nagar West, Perambur, Chennai, Tamil Nadu 600082, India",13.1162632,80.2261246,"Hotel Kalyana Bhavan Biriyani, Park Circle, 20/3, College Rd, Thousand Lights West, Nungambakkam, Chennai, Tamil Nadu 600006, India",13.0668136,80.2538281,10.217,1768,0,0,f,,,,,178,,,,,,,,22-10-2025,17:51:58,22-10-2025
781,319,,PENDING,RIDE,"B Block, Rail Nagar Bridge, Padi Kuppam, Koyambedu, Chennai, Tamil Nadu 600107, India",13.0766688,80.1909987,"Billroth Hospitals, 43, Lakshmi Talkies Rd, Shenoy Nagar, Chennai, Tamil Nadu 600030, India",13.0757774,80.2272901,4.629,765,0,0,f,,,,,107,,,,,,,,23-10-2025,01:30:11,23-10-2025
787,388,,DRIVER_NOT_FOUND,RIDE,"6/17, Bharatheeswarar Colony, 5st B, E colony, Kodambakkam, Chennai, Tamil Nadu 600024, India",13.0567094,80.2206333,"Shri Krishnaswamy College For Women, 48, 4th St, Block AC, AC Block, Anna Nagar, Chennai, Tamil Nadu 600040, India",13.0839732,80.2118298,4.398,887,0,0,f,,,,,107,,,,,,,,23-10-2025,02:43:38,23-10-2025
782,363,,DRIVER_NOT_FOUND,RIDE,"Hotel O Meenaachi Inn, 155/71, Langs Garden Rd, Varadarajapuram, Pudupet, Komaleeswaranpet, Egmore, Chennai, Tamil Nadu 600002, India",13.0753588,80.265318,"Don Bosco Mat. Hr. Sec. School, 3794+R3M, 13, CASA Major Rd, Sulaiman Zackria Avenue, Egmore, Chennai, Tamil Nadu 600008, India",13.0704208,80.2550616,1.876,354,0,0,t,,,,,49,,,,,,,,23-10-2025,01:43:47,23-10-2025
790,263,,PENDING,RIDE,"Palkar Homes, 109, Addison Nagar Main Rd, Sendur Puram, Mangadu, Chennai, Tamil Nadu 600056, India",13.0337092,80.1207705,"ANN Hospital, No 81 - 85, Annai Terasa Street, Indira Nagar, Valasaravakkam, Near Indian Bank, 57, Valli St, Madurai Meenakshi Nagar, Valasaravakkam, Chennai, Tamil Nadu 600087, India",13.0406203,80.1784037,7.556,1513,0,0,f,,,,,145,,,,,,,,23-10-2025,03:40:25,23-10-2025
788,388,,DRIVER_NOT_FOUND,RIDE,"6/17, Bharatheeswarar Colony, 5st B, E colony, Kodambakkam, Chennai, Tamil Nadu 600024, India",13.0567001,80.2206223,"Shri Krishnaswamy College For Women, 48, 4th St, Block AC, AC Block, Anna Nagar, Chennai, Tamil Nadu 600040, India",13.0839732,80.2118298,4.399,887,0,0,f,,,,,107,,,,,,,,23-10-2025,02:46:51,23-10-2025
784,387,,OUTSIDE_SERVICE_AREA,RIDE,"1st Main Rd, 4th cross, 39, Guru Raghavendra Nagar, Lakshmi Nagar, Phase 7, J. P. Nagar, Bengaluru, Karnataka 560078, India",12.89312366,77.57855481,"Aflog, 1936, 5th Cross Street, 20th Main Rd, R.K Colony, Marenahalli, 2nd Phase, J. P. Nagar, Bengaluru, Karnataka 560041, India",12.9127291,77.5884017,3.412,763,0,0,f,,,,,0,,,,,,,,23-10-2025,02:41:49,23-10-2025
783,120,10,COMPLETED,RIDE,"Metrozone N Tower, 44, Pillaiyar Koil Street, Off, Jawaharlal Nehru Salai, behind Vcare Hospital, Anna Nagar West, Anna Nagar, Chennai, Tamil Nadu 600040, India",13.0835308,80.1941479,"Narayana Olympiad School- Mogappair, EB Office Rd, Golden George Nagar, Mogappair East, Chennai, Tamil Nadu 600037, India",13.0795366,80.1826181,2.253,517,6,36,f,3,,13.0798088,80.19432932,88,88,0,45953.10229,45953.12746,45953.09685,3155,3161,23-10-2025,03:03:33,23-10-2025
785,388,,DRIVER_NOT_FOUND,RIDE,"6/17, Bharatheeswarar Colony, 5st B, E colony, Kodambakkam, Chennai, Tamil Nadu 600024, India",13.056708,80.2206333,"Shri Krishnaswamy College For Women, 48, 4th St, Block AC, AC Block, Anna Nagar, Chennai, Tamil Nadu 600040, India",13.0839732,80.2118298,4.398,887,0,0,f,,,,,107,,,,,,,,23-10-2025,02:42:37,23-10-2025
786,388,,DRIVER_NOT_FOUND,RIDE,"6/17, Bharatheeswarar Colony, 5st B, E colony, Kodambakkam, Chennai, Tamil Nadu 600024, India",13.0567088,80.220649,"Shri Krishnaswamy College For Women, 48, 4th St, Block AC, AC Block, Anna Nagar, Chennai, Tamil Nadu 600040, India",13.0839732,80.2118298,4.386,880,0,0,f,,,,,107,,,,,,,,23-10-2025,02:43:01,23-10-2025
792,187,10,CANCELLED,RIDE,"Crown Residences - Baashyaam Constructions, TALUK VILLAGE NO: 33 & 35, Poonamallee High Rd, AMINJAKARAI, Koyambedu, Chennai, Tamil Nadu 600107, India",13.0766147,80.1937765,"Directorate of Stationery and Printing, 110, Anna Salai, Chintadripet, Chennai, Tamil Nadu 600002, India",13.0656312,80.2664793,10.007,1646,0,0,f,,2,13.07855665,80.19903392,178,,,,,45953.16198,,,23-10-2025,04:07:37,23-10-2025
789,377,10,COMPLETED,RIDE,"Golden Jubilee Flats, Sathya Sai Nagar, Thirumangalam, Anna Nagar West Extension, Chennai, Tamil Nadu 600040, India",13.0816026,80.1925412,"THIRUMANGALAM METRO PARKING, 36P2+2V2, L Block, Kurinji Colony, Anna Nagar, Chennai, Tamil Nadu 600040, India",13.0850203,80.2021362,2.034,489,2,6,t,,,13.07979613,80.19434541,88,88,88,45953.14686,45953.15117,45953.14239,3164,3166,23-10-2025,03:38:09,23-10-2025
797,296,36,CANCELLED,RIDE,"11/9a, Anadavar Nagar 2nd St, 11/9a, Anadavar Nagar 2nd St, Andavar Nagar, Kodambakkam, Chennai, Tamil Nadu 600024, India",13.0564316,80.2177785,"29, Josier St, 29, Josier St, Tirumurthy Nagar, Nungambakkam, Chennai, Tamil Nadu 600034, India",13.0536131,80.245502,6.336,1166,0,0,f,,,13.04130385,80.20519227,126,,,,,45953.18934,,,23-10-2025,04:35:07,23-10-2025
794,187,10,COMPLETED,RIDE,"550/2, Poonamallee High Rd, Arumbakkam, Chennai, Tamil Nadu 600106, India",13.07634,80.2023596,"Directorate of Stationery and Printing, 110, Anna Salai, Chintadripet, Chennai, Tamil Nadu 600002, India",13.0656312,80.2664793,8.956,1449,9,34,f,,,13.0763413,80.20235449,162,162,162,45953.17266,45953.19631,45953.17219,3170,3179,23-10-2025,04:42:47,23-10-2025
795,362,,PENDING,RIDE,"367H+XPJ, Basha St, Thiruvalluvar Puram, Choolaimedu, Chennai, Tamil Nadu 600094, India",13.0648997,80.2293996,"Presidency College Chennai, Presidency College, 100, Kamarajar Promenade, PWD Estate, Chepauk, Triplicane, Chennai, Tamil Nadu 600005, India",13.0587687,80.2818375,7.757,1246,0,0,f,,,,,145,,,,,,,,23-10-2025,04:11:20,23-10-2025
796,296,,PENDING,RIDE,"11/9a, Anadavar Nagar 2nd St, 11/9a, Anadavar Nagar 2nd St, Andavar Nagar, Kodambakkam, Chennai, Tamil Nadu 600024, India",13.0564316,80.2177785,"29, Josier St, 29, Josier St, Tirumurthy Nagar, Nungambakkam, Chennai, Tamil Nadu 600034, India",13.0536131,80.245502,6.336,1166,0,0,f,,,,,126,,,,,,,,23-10-2025,04:31:02,23-10-2025
798,392,,DRIVER_NOT_FOUND,RIDE,"15/14, 1st St, Venkatesa Nagar Extension-2, Chinmaya Nagar Stage II Extension, Ramalinga Nagar, Koyambedu, Chennai, Tamil Nadu 600092, India",13.0611959,80.1922649,"Nehru Park Metro, Sastri Nagar, Chetpet, Chennai, Tamil Nadu 600084, India",13.0789342,80.25077809,8.625,1374,0,0,f,,1,,,162,,,,,,,,23-10-2025,05:17:08,23-10-2025
793,390,18,COMPLETED,RIDE,"Rohini Silver Screens, 141/2, Poonamallee High Rd, Koyambedu, Chennai, Tamil Nadu 600107, India",13.0757486,80.1958707,"29, Wuthucatton St, 29, Wuthucatton St, Periamet, Poongavanapuram, Chennai, Tamil Nadu 600003, India",13.0829107,80.2682184,8.303,1467,8,29,f,,1,13.07447322,80.22155911,162,162,0,45953.17978,45953.20036,45953.16996,5926,5934,23-10-2025,04:48:31,23-10-2025
799,392,,DRIVER_NOT_FOUND,RIDE,"15/14, 1st St, Venkatesa Nagar Extension-2, Chinmaya Nagar Stage II Extension, Ramalinga Nagar, Koyambedu, Chennai, Tamil Nadu 600092, India",13.0611757,80.1923445,"Nehru Park Metro, Sastri Nagar, Chetpet, Chennai, Tamil Nadu 600084, India",13.07895477,80.25077205,8.618,1373,0,0,f,,1,,,162,,,,,,,,23-10-2025,05:17:52,23-10-2025
800,367,,DRIVER_NOT_FOUND,RIDE,"11/13, Vedha Nagar, Chinmaya Nagar Stage II Extension, Koyambedu, Chennai, Tamil Nadu 600092, India",13.06125324,80.1923807,"Nehru Park Metro, Sastri Nagar, Chetpet, Chennai, Tamil Nadu 600084, India",13.07891526,80.25080156,8.613,1371,0,0,f,,2,,,162,,,,,,,,23-10-2025,05:19:33,23-10-2025
821,402,,PENDING,RIDE,"134, 6th Main Rd, X Block, Y Block, Anna Nagar, Chennai, Tamil Nadu 600040, India",13.08533273,80.212979,"51, Palaiyam Nagar, Ayanavaram, Chennai, Tamil Nadu 600023, India",13.09254236,80.22760917,2.885,531,0,0,f,,,,,88,,,,,,,,23-10-2025,15:03:39,23-10-2025
805,388,18,CANCELLED,RIDE,"9/38, AC Block 4th St, Block AC, AC Block, Anna Nagar, Chennai, Tamil Nadu 600040, India",13.0839746,80.2120086,"LATHA TEXTILES & GARMENTS, 2/19, Bharatheswar St, Bharatheeswarar Colony, Bharatheswarar Colony, Kodambakkam, Chennai, Tamil Nadu 600024, India",13.0569553,80.220555,4.536,900,0,0,f,,,13.07680516,80.21817952,107,,,,,45953.34924,,,23-10-2025,08:23:05,23-10-2025
806,388,35,COMPLETED,RIDE,"48, 4th St, Block AC, AC Block, Anna Nagar, Chennai, Tamil Nadu 600040, India",13.0840431,80.2119322,"LATHA TEXTILES & GARMENTS, 2/19, Bharatheswar St, Bharatheeswarar Colony, Bharatheswarar Colony, Kodambakkam, Chennai, Tamil Nadu 600024, India",13.0569553,80.220555,4.545,902,5,19,f,,,13.07857693,80.19917876,107,107,107,45953.35811,45953.37151,45953.35073,3590,3595,23-10-2025,08:56:51,23-10-2025
802,65,,PENDING,RIDE,"Block-Y, METROZONE TOWERS, Anna Nagar West, Anna Nagar West Extension, Chennai, Tamil Nadu 600040, India",13.08091069,80.19552544,"20, IV Lane, Nungambakkam High Rd, Thousand Lights West, Thousand Lights, Chennai, Tamil Nadu 600034, India",13.0557886,80.250348,9.71,1649,0,0,f,,,,,173,,,,,,,,23-10-2025,06:28:58,23-10-2025
801,187,10,COMPLETED,RIDE,"Directorate of Stationery and Printing, 110, Anna Salai, Chintadripet, Chennai, Tamil Nadu 600002, India",13.0656312,80.2664793,"Bank of Baroda Ramkrishna Nagar Branch, NO.15, Sringeri Mutt Rd, R K Nagar, Ramakrishna Nagar, Raja Annamalaipuram, Chennai, Tamil Nadu 600028, India",13.02415,80.2621,9.394,1412,10,26,f,,,13.06537103,80.26686162,173,173,173,45953.23222,45953.25064,45953.23186,3179,3189,23-10-2025,07:04:19,23-10-2025
803,392,,DRIVER_NOT_FOUND,RIDE,"196/877, near Sangam Theatre, Purasaiwakkam, Chennai, Tamil Nadu 600084, India",13.0794665,80.2507821,"15/14, 15/14, 1st St, Venkatesa Nagar Extension-2, Chinmaya Nagar Stage II Extension, Ramalinga Nagar, Koyambedu, Chennai, Tamil Nadu 600092, India",13.0611664,80.1923994,8.866,1596,0,0,f,,1,,,162,,,,,,,,23-10-2025,07:11:39,23-10-2025
804,367,18,CANCELLED,RIDE,"Koyambedu, Koyambedu, Chennai, Tamil Nadu 600107, India",13.0731136,80.1952498,"15/14, 1st St, Venkatesa Nagar Extension-2, Chinmaya Nagar Stage II Extension, Ramalinga Nagar, Koyambedu, Chennai, Tamil Nadu 600092, India",13.06122744,80.19237433,2.418,551,0,0,f,,2,13.08177068,80.21778256,88,,,,,45953.33312,,,23-10-2025,08:21:20,23-10-2025
807,394,18,COMPLETED,RIDE,"48, 4th St, Block AC, AC Block, Anna Nagar, Chennai, Tamil Nadu 600040, India",13.08404902,80.21187734,"Metro Station, 35FW+5J3 Metro Station, 9, Srinivasa Nagar Main Rd, behind Koyembedu, next to Sivan Koil Street, Sriniivasa Nagar, Virrugambakkam, Koyambedu, Chennai, Tamil Nadu 600107, India",13.0728823,80.1964304,3.823,670,4,13,f,,,13.07604221,80.21343738,89,89,89,45953.36447,45953.37358,45953.35587,5961,5965,23-10-2025,09:17:37,23-10-2025
810,318,35,COMPLETED,RIDE,"National Star Matriculation Higher Secondary School, 36G5+496, No: 6, VOC St, Jagannatha Nagar, Arumbakkam, Chennai, Tamil Nadu 600106, India",13.0752116,80.2079872,"SIGARAM FOUNDATION, No:19, 14th St, Jai Nagar, Arumbakkam, Chennai, Tamil Nadu 600106, India",13.0717561,80.2073029,0.713,231,1,7,f,,,13.07450617,80.22159666,39,39,39,45953.43406,45953.4393,45953.42601,3602,3603,23-10-2025,10:32:39,23-10-2025
808,394,35,CANCELLED,RIDE,"4-7/A, Sriniivasa Nagar, Virrugambakkam, Virugambakkam, Chennai, Tamil Nadu 600107, India",13.0706321,80.1969428,"Shri Krishnaswamy College For Women, 48, 4th St, Block AC, AC Block, Anna Nagar, Chennai, Tamil Nadu 600040, India",13.0839732,80.2118298,4.096,824,0,0,f,,1,13.07416398,80.22097975,107,,,,,45953.40056,,,23-10-2025,09:36:53,23-10-2025
809,318,,PENDING,RIDE,"National Star Matriculation Higher Secondary School, 36G5+496, No: 6, VOC St, Jagannatha Nagar, Arumbakkam, Chennai, Tamil Nadu 600106, India",13.0752116,80.2079872,"SIGARAM FOUNDATION, No:19, 14th St, Jai Nagar, Arumbakkam, Chennai, Tamil Nadu 600106, India",13.0717561,80.2073029,0.713,231,0,0,f,,,,,39,,,,,,,,23-10-2025,10:12:32,23-10-2025
814,377,35,CANCELLED,RIDE,"Building, 9th, 2nd Ave, Nehru Nagar, Anna Nagar, Chennai, Tamil Nadu 600040, India",13.0853138,80.199372,"SCR Soft Technologies (P) Ltd, SCR SOFT TECHNOLOGIES (P) LTD, Plot No 56, Guruswamy St, VGN CH 40, Sathya Sai Nagar, PHASE-2, Anna Nagar, Chennai, Tamil Nadu 600040, India",13.0813505,80.1926908,3.772,738,0,0,f,2,,13.07441238,80.22132307,89,,,,,45953.56049,,,23-10-2025,13:27:25,23-10-2025
811,398,,OUTSIDE_SERVICE_AREA,RIDE,"4/423, Ramalinga Nagar, Perungudi, Chennai, Tamil Nadu 600041, India",12.97729689,80.25231647,"31&32 Metrocity phase 2, 349W+CMF, Vadanoombal, Maduravoyal, Chennai, Tamil Nadu 600095, India",13.0685688,80.1466719,21.029,3031,0,0,f,,,,,0,,,,,,,,23-10-2025,11:09:05,23-10-2025
812,393,,OUTSIDE_SERVICE_AREA,RIDE,"International Tech Park Chennai, Taramani, No 7 & 8 1st Floor, Pinnacle Building, International Tech Park, CSIR Rd, Tharamani, Chennai, Tamil Nadu 600113, India",12.984803,80.2460148,"Osian Chlorophyll, Osian Chlorophyll, Gandhi Nagar, Porur, Chennai, Tamil Nadu 600116, India",13.0393761,80.147394,16.376,2327,0,0,f,,,,,0,,,,,,,,23-10-2025,11:10:31,23-10-2025
813,393,,OUTSIDE_SERVICE_AREA,RIDE,"X6MW+R8J, Tharamani, Chennai, Tamil Nadu 600113, India",12.98442327,80.24568039,"Osian Chlorophyll, Osian Chlorophyll, Gandhi Nagar, Porur, Chennai, Tamil Nadu 600116, India",13.0393761,80.147394,16.417,2331,0,0,f,,,,,0,,,,,,,,23-10-2025,11:10:56,23-10-2025
815,377,35,CANCELLED,RIDE,"Anna Nagar, Tirumaniamman Nagar, Anna Nagar, Chennai, Tamil Nadu 600040, India",13.085394,80.199138,"SCR Soft Technologies (P) Ltd, SCR SOFT TECHNOLOGIES (P) LTD, Plot No 56, Guruswamy St, VGN CH 40, Sathya Sai Nagar, PHASE-2, Anna Nagar, Chennai, Tamil Nadu 600040, India",13.0813505,80.1926908,3.594,679,0,0,f,2,,13.07441238,80.22132307,89,,,,,45953.56085,,,23-10-2025,13:27:43,23-10-2025
816,191,35,CANCELLED,RIDE,"Glow - Skin | Beauty | Wellness, 3rd Floor, Door No:3, Khader Nawaz Khan Rd, Thousand Lights West, Thousand Lights, Chennai, Poombukar Nagar, Tamil Nadu 600006, India",13.0608153,80.2513913,"Appaswamy Towers, 26QR+WR3, Sir Thyagaraya Rd, T. Nagar, Chennai, Tamil Nadu 600017, India",13.0397711,80.2420573,4,763,0,0,f,,,13.07441238,80.22132307,89,,,,,45953.56942,,,23-10-2025,13:42:44,23-10-2025
822,402,,PENDING,RIDE,"Y-225, 6th Main Rd, opposite Ayyappan Temple, X Block, Y Block, Anna Nagar, Chennai, Tamil Nadu 600040, India",13.08520134,80.2129955,"51, 51, Palaiyam Nagar, Ayanavaram, Chennai, Tamil Nadu 600023, India",13.0926651,80.2275723,2.865,521,0,0,f,,,,,88,,,,,,,,23-10-2025,15:04:15,23-10-2025
823,268,,OUTSIDE_SERVICE_AREA,RIDE,"61C/25, Bharathi Nagar, Ayanavaram, Chennai, Tamil Nadu 600023, India",13.0959243,80.2290383,"Avadi Bus Depot, Avadi Bus Depot, Bhaktavatsala Puram, Vasantham Nagar, Avadi, Tamil Nadu 600054, India",13.1206137,80.1019832,17.983,2720,0,0,f,,,,,0,,,,,,,,23-10-2025,15:13:31,23-10-2025
824,403,,OUTSIDE_SERVICE_AREA,RIDE,"23/12, Chakaravarthy Nagar, Vasantha nagar, Chinna Chembarambakkam, Ayanavaram, Chennai, Tamil Nadu 600023, India",13.10021549,80.23531698,"KG 360 Degrees, X6FW+52W, N Veeranam Salai, Kandhanchavadi, Perungudi, Chennai, Tamil Nadu 600096, India",12.9729991,80.2450683,18.987,3122,0,0,f,,,,,0,,,,,,,,23-10-2025,15:28:56,23-10-2025
825,403,,PENDING,RIDE,"23/12, Chakaravarthy Nagar, Vasantha nagar, Chinna Chembarambakkam, Ayanavaram, Chennai, Tamil Nadu 600023, India",13.10021549,80.23531698,"C.S.I St. James Church, 15, 3rd Main Rd, United India Nagar, Ayanavaram, Chennai, Tamil Nadu 600023, India",13.0981706,80.2296104,1.275,405,0,0,f,,,,,49,,,,,,,,23-10-2025,15:29:19,23-10-2025
826,345,,PENDING,RIDE,"20/1, Dasarathapuram Main Rd, Dasaratha Puram, Saligramam, Chennai, Tamil Nadu 600093, India",13.057279,80.2027748,"1st Main Road, 1st Main Rd, Sri Venkatesh Nagar, Sai Baba Colony, Virugambakkam, Chennai, Tamil Nadu, India",13.0567662,80.1945449,1.034,232,0,0,f,,,,,49,,,,,,,,23-10-2025,15:50:29,23-10-2025
881,423,,PENDING,RIDE,"13, Valliammal Rd, Vepery, Purasaiwakkam, Chennai, Tamil Nadu 600007, India",13.0818605,80.2573801,"Avadhanam Papier Road, Avadhanam Papier Road, Choolai, Chennai, Tamil Nadu 600007, India",13.0904072,80.2621371,1.881,348,0,0,f,,,,,49,,,,,,,,24-10-2025,12:58:30,24-10-2025
834,286,,PENDING,RIDE,"Abhinav gardens, 266F+RGF, Venkta Puram, Saidapet, Chennai, Tamil Nadu 600015, India",13.0120632,80.2237206,"SRM School of Environment Architecture & Design, Door No: 701, 7A, PG Block, SEAD, Bharathi Salai, Ramapuram, Chennai, Tamil Nadu 600089, India",13.0338507,80.1800376,8.867,1375,0,0,f,,,,,162,,,,,,,,24-10-2025,01:55:52,24-10-2025
827,405,35,CANCELLED,RIDE,"35HX+CPF, Old Tirumangalam, Anna Nagar, Chennai, Tamil Nadu 600040, India",13.07855831,80.19918345,"Vr mall, 35JX+M2X, Metrozone Driveway, Anna Nagar West, Chennai, Tamil Nadu 600040, India",13.0817317,80.1976217,1.882,286,0,0,f,,,13.07849075,80.19907147,49,,,,,45953.6871,,,23-10-2025,16:32:12,23-10-2025
829,407,,OUTSIDE_SERVICE_AREA,RIDE,"Rail Nagar flats, 35GR+H4W, Padi Kuppam, Koyambedu, Chennai, Tamil Nadu 600107, India",13.0764929,80.1903329,"Standard Chartered Bank Rajaji Salai Branch Chennai, 19 Rajaji Salai, Fort Saint George, Railway station, 90/19, Rajaji Salai Rd, opposite 2nd Line Beach Road, Parry's Corner, George Town, Chennai, Tamil Nadu 600001, India",13.090291,80.2906915,12.156,2101,0,0,f,,,,,0,,,,,,,,23-10-2025,16:58:43,23-10-2025
835,120,10,COMPLETED,RIDE,"Metrozone N Tower, 44, Pillaiyar Koil Street, Off, Jawaharlal Nehru Salai, behind Vcare Hospital, Anna Nagar West, Anna Nagar, Chennai, Tamil Nadu 600040, India",13.0835308,80.1941479,"Narayana Olympiad School- Mogappair, EB Office Rd, Golden George Nagar, Mogappair East, Chennai, Tamil Nadu 600037, India",13.0795366,80.1826181,2.253,517,2,9,f,3,,13.07983922,80.19433469,88,88,0,45954.1018,45954.10827,45954.09408,3345,3347,24-10-2025,02:35:54,24-10-2025
836,407,,OUTSIDE_SERVICE_AREA,RIDE,"Rail Nagar flats, 35GR+H4W, Padi Kuppam, Koyambedu, Chennai, Tamil Nadu 600107, India",13.0764929,80.1903329,"Standard Chartered Bank Rajaji Salai Branch Chennai, 19 Rajaji Salai, Fort Saint George, Railway station, 90/19, Rajaji Salai Rd, opposite 2nd Line Beach Road, Parry's Corner, George Town, Chennai, Tamil Nadu 600001, India",13.090291,80.2906915,15.646,2724,0,0,f,,,,,0,,,,,,,,24-10-2025,02:45:43,24-10-2025
832,319,,PENDING,RIDE,"B Block, Rail Nagar Bridge, Padi Kuppam, Koyambedu, Chennai, Tamil Nadu 600107, India",13.0766221,80.1909287,"Billroth Hospitals, 43, Lakshmi Talkies Rd, Shenoy Nagar, Chennai, Tamil Nadu 600030, India",13.0757774,80.2272901,8.125,1390,0,0,f,,,,,162,,,,,,,,24-10-2025,01:43:46,24-10-2025
837,410,,OUTSIDE_SERVICE_AREA,RIDE,"Amarprakash Temple Waves Tower-G, Tamil Nadu 600069, India",12.9769953,80.1090687,"Eminents prakalya apartments, 37, Manimegalai St, Ramakrishanapuram, Tambaram, Chennai, Tamil Nadu 600059, India",12.9270448,80.1323156,13.376,2083,0,0,f,,,,,0,,,,,,,,24-10-2025,03:12:29,24-10-2025
839,377,12,COMPLETED,RIDE,"Golden Jubilee Flats, Sathya Sai Nagar, Thirumangalam, Anna Nagar West Extension, Chennai, Tamil Nadu 600040, India",13.0815922,80.1924534,"Thirumangalam Metro, Anna Nagar West, Anna Nagar, Chennai, Tamil Nadu 600040, India",13.0854821,80.2009823,1.694,399,2,7,f,2,,13.07550992,80.21758944,49,49,0,45954.15416,45954.15932,45954.14095,3617,3619,24-10-2025,03:49:25,24-10-2025
838,338,10,COMPLETED,RIDE,"Triumph Apartments, Ashoka Nagar Main Rd, Annai Sathya Nagar, Koyambedu, Chennai, Tamil Nadu 600106, India",13.06451277,80.21075014,"Akshar Arbol International School, 7/2, Chari St, T. Nagar, Chennai, Tamil Nadu 600017, India",13.0481647,80.2322448,5.965,1125,6,28,f,,,13.07766189,80.19887298,120,120,120,45954.15286,45954.17241,45954.14012,3357,3363,24-10-2025,04:19:20,24-10-2025
840,338,10,CANCELLED,RIDE,"2, Chari St, Old, T. Nagar, Chennai, Tamil Nadu 600017, India",13.04836338,80.23244452,"Triumph Apartment, 9, Jawaharlal Nehru Salai, beside Radha Regent, Annai Sathya Nagar, Arumbakkam, Chennai, Tamil Nadu 600106, India",13.0644919,80.2109988,6.44,1138,0,0,f,,,13.04837319,80.23218602,126,,,,,45954.19559,,,24-10-2025,04:42:23,24-10-2025
868,417,,DRIVER_NOT_FOUND,RIDE,"Corporation of Chennai, Ambattur Office, Zone 7, 4543+H5G, Chennai - Tiruttani Hwy, Kamarajapuram, Ambattur, Chennai, Tamil Nadu 600053, India",13.1064306,80.1529535,"Officers Colony Park, 35RP+28P, TVS Colony, Padi, Chennai, Tamil Nadu 600101, India",13.0900886,80.1858224,5.164,870,0,0,f,,,,,120,,,,,,,,24-10-2025,10:48:57,24-10-2025
845,412,,DRIVER_NOT_FOUND,RIDE,"8A/14, Bharthi Nagar, Srinivasa Nagar, Koyambedu, Chennai, Tamil Nadu 600107, India",13.0706292,80.196871,"Shri Krishnaswamy College For Women, 48, 4th St, Block AC, AC Block, Anna Nagar, Chennai, Tamil Nadu 600040, India",13.0839732,80.2118298,4.104,827,0,0,f,,,,,107,,,,,,,,24-10-2025,05:55:27,24-10-2025
850,414,,DRIVER_NOT_FOUND,RIDE,"2, 5th St, 2, 5th St, Seetammal Colony, MIG Colony, Alwarpet, Chennai, Tamil Nadu 600018, India",13.033689,80.2514723,"JewelOne Anna Nagar, JewelOne, Near Thirumangalam Metro station, 233-235, 2nd Ave, L Block, Anna Nagar West, Anna Nagar, Chennai, Tamil Nadu 600040, India",13.0850651,80.201262,11.422,1937,0,0,f,,1,,,234,,,,,,,,24-10-2025,06:55:07,24-10-2025
841,338,10,COMPLETED,RIDE,"5/1/2,1/3, Chari St, T. Nagar, Chennai, Tamil Nadu 600017, India",13.04832435,80.23246773,"DON BOSCO SCHOOL OF EXCELLENCE, 53, Pantheon Rd, Sulaiman Zackria Avenue, Egmore, Chennai, Tamil Nadu 600008, India",13.0690584,80.2546615,4.886,753,0,0,f,,,13.04837319,80.23218602,107,107,107,45954.19665,45954.19671,45954.1965,3364,3364,24-10-2025,05:04:48,24-10-2025
854,265,,OUTSIDE_SERVICE_AREA,RIDE,"43, Vivekananda St, Vasantham Nagar, Kumaran Nagar, Perambur, Chennai, Tamil Nadu 600082, India",13.11091673,80.21428998,"VGN Stafford, Vgn Stafford, Sudarsanam Main Rd, Thirumalai Vasan Nagar, Poompozhil Nagar, Thirumullaivoyal, Avadi, Tamil Nadu 600062, India",13.1307935,80.119769,15.688,2479,0,0,f,,,,,0,,,,,,,,24-10-2025,07:37:56,24-10-2025
844,380,,OUTSIDE_SERVICE_AREA,RIDE,"BLOCK-B, METROZONE TOWERS, Anna Nagar West, Anna Nagar West Extension, Chennai, Tamil Nadu 600040, India",13.08030203,80.19408401,"C1 Flower Bazaar Police Station, 37QJ+8MW, Rattan Bazaar Rd, Rattan Bazaar, George Town, Chennai, Tamil Nadu 600003, India",13.0883724,80.2817022,11.918,2237,0,0,f,,,,,0,,,,,,,,24-10-2025,05:39:18,24-10-2025
842,392,12,COMPLETED,RIDE,"11/13, Vedha Nagar, Chinmaya Nagar Stage II Extension, Koyambedu, Chennai, Tamil Nadu 600092, India",13.06125259,80.19237634,"Nehru Park Metro, Sastri Nagar, Chetpet, Chennai, Tamil Nadu 600084, India",13.07890807,80.25078747,8.752,1480,10,34,f,,1,13.07564679,80.21785766,162,162,0,45954.22092,45954.24459,45954.2056,3627,3637,24-10-2025,05:52:12,24-10-2025
848,409,,PENDING,RIDE,"Koyambedu, Koyambedu, Chennai, Tamil Nadu, India",13.0693568,80.1948314,"Ambattur Railway Station, Ambattur Railway Station, Ambattur Railway Station, Varadaraja Puram, Ambattur, Chennai, Tamil Nadu 600053, India",13.1141251,80.1525617,10.62,1628,0,0,f,,,,,178,,,,,,,,24-10-2025,06:03:48,24-10-2025
849,413,,OUTSIDE_SERVICE_AREA,RIDE,"Chennai, Chennai, Tamil Nadu, India",13.0843007,80.2704622,"Verizon India Pvt Ltd, 2673+Q5G, SIDCO Industrial Estate, Guindy, Chennai, Tamil Nadu 600032, India",13.0144258,80.2029687,16.284,2325,0,0,f,,,,,0,,,,,,,,24-10-2025,06:24:26,24-10-2025
